{
  "$schema": "https://json-schema.org/draft/2020-12/schema",
  "$comment": "Additional cross-field constraints (profile uniqueness, summary mode, inherited baseline) are enforced by route_model.py; see routing.md.",
  "type": "object",
  "properties": {
    "schema_version": {
      "enum": [
        1
      ],
      "type": "integer"
    },
    "mode": {
      "enum": [
        "off",
        "shadow",
        "adaptive"
      ],
      "type": "string"
    },
    "router_model": {
      "type": "string",
      "minLength": 1,
      "maxLength": 256
    },
    "key_env": {
      "type": "string",
      "minLength": 1,
      "maxLength": 256,
      "pattern": "^[A-Za-z_][A-Za-z0-9_]*$"
    },
    "timeout_ms": {
      "type": "integer",
      "minimum": 1,
      "maximum": 10000
    },
    "max_calls": {
      "type": "integer",
      "minimum": 0,
      "maximum": 100
    },
    "data_mode": {
      "enum": [
        "categories",
        "summary"
      ],
      "type": "string"
    },
    "objective": {
      "enum": [
        "latency",
        "usage",
        "cost"
      ],
      "type": "string"
    },
    "min_confidence": {
      "type": "number",
      "minimum": 0,
      "maximum": 1
    },
    "allowed_candidates": {
      "type": "array",
      "items": {
        "type": "string",
        "minLength": 1,
        "maxLength": 32,
        "pattern": "^(?!defer$)[a-z][a-z0-9_-]{0,31}$"
      },
      "uniqueItems": true,
      "maxItems": 16,
      "minItems": 0
    },
    "adaptive_roles": {
      "type": "array",
      "items": {
        "enum": [
          "docs-writer",
          "pr-author"
        ],
        "type": "string"
      },
      "uniqueItems": true,
      "maxItems": 2,
      "minItems": 0
    },
    "max_cost_usd": {
      "anyOf": [
        {
          "type": "number",
          "minimum": 0
        },
        {
          "type": "null"
        }
      ]
    },
    "max_latency_ms": {
      "anyOf": [
        {
          "type": "number",
          "minimum": 0
        },
        {
          "type": "null"
        }
      ]
    },
    "candidates": {
      "type": "array",
      "items": {
        "type": "object",
        "properties": {
          "id": {
            "type": "string",
            "minLength": 1,
            "maxLength": 32,
            "pattern": "^(?!defer$)[a-z][a-z0-9_-]{0,31}$"
          },
          "host": {
            "enum": [
              "claude-native",
              "claude-skill",
              "codex-skill"
            ],
            "type": "string"
          },
          "model": {
            "type": "string",
            "minLength": 1,
            "maxLength": 256
          },
          "effort": {
            "anyOf": [
              {
                "enum": [
                  "none",
                  "minimal",
                  "low",
                  "medium",
                  "high",
                  "xhigh",
                  "max",
                  "ultra"
                ],
                "type": "string"
              },
              {
                "type": "null"
              }
            ]
          },
          "roles": {
            "type": "array",
            "items": {
              "enum": [
                "accessibility-reviewer",
                "architecture-reviewer",
                "debug-investigator",
                "docs-writer",
                "feature-implementer",
                "fog-cartographer",
                "migration-safety-reviewer",
                "observability-reviewer",
                "ops-readiness-reviewer",
                "performance-reviewer",
                "plugin-validator",
                "pr-author",
                "prototype-builder",
                "refactorer",
                "reliability-reviewer",
                "security-reviewer",
                "test-author",
                "ui-test-author"
              ],
              "type": "string"
            },
            "uniqueItems": true,
            "maxItems": 18,
            "minItems": 1
          },
          "categories": {
            "type": "array",
            "items": {
              "enum": [
                "docs",
                "pr",
                "implementation",
                "tests",
                "debug",
                "review",
                "prototype",
                "refactor"
              ],
              "type": "string"
            },
            "uniqueItems": true,
            "maxItems": 8,
            "minItems": 1
          },
          "capabilities": {
            "type": "array",
            "items": {
              "type": "string",
              "minLength": 1,
              "maxLength": 256,
              "pattern": "^[A-Za-z][A-Za-z0-9_-]*$"
            },
            "uniqueItems": true,
            "maxItems": 16,
            "minItems": 0
          },
          "context_tokens": {
            "type": "integer",
            "minimum": 1,
            "maximum": 10000000
          },
          "quality": {
            "anyOf": [
              {
                "type": "number",
                "minimum": 0,
                "maximum": 1
              },
              {
                "type": "null"
              }
            ]
          },
          "latency_ms": {
            "anyOf": [
              {
                "type": "number",
                "minimum": 0
              },
              {
                "type": "null"
              }
            ]
          },
          "cost_usd": {
            "anyOf": [
              {
                "type": "number",
                "minimum": 0
              },
              {
                "type": "null"
              }
            ]
          },
          "usage_tokens": {
            "anyOf": [
              {
                "type": "integer",
                "minimum": 0
              },
              {
                "type": "null"
              }
            ]
          },
          "profile_revision": {
            "type": "string",
            "minLength": 1,
            "maxLength": 256
          },
          "qualification": {
            "anyOf": [
              {
                "type": "object",
                "properties": {
                  "report_hash": {
                    "type": "string",
                    "pattern": "^[0-9a-f]{64}$",
                    "minLength": 64,
                    "maxLength": 64
                  },
                  "profile_hash": {
                    "type": "string",
                    "pattern": "^[0-9a-f]{64}$",
                    "minLength": 64,
                    "maxLength": 64
                  },
                  "expires_at": {
                    "type": "number",
                    "exclusiveMinimum": 0
                  },
                  "host_revision": {
                    "type": "string",
                    "minLength": 1,
                    "maxLength": 256
                  },
                  "router_request": {
                    "type": "string",
                    "minLength": 1,
                    "maxLength": 256
                  },
                  "router_identity": {
                    "type": "string",
                    "minLength": 1,
                    "maxLength": 256
                  },
                  "roles": {
                    "type": "array",
                    "items": {
                      "enum": [
                        "accessibility-reviewer",
                        "architecture-reviewer",
                        "debug-investigator",
                        "docs-writer",
                        "feature-implementer",
                        "fog-cartographer",
                        "migration-safety-reviewer",
                        "observability-reviewer",
                        "ops-readiness-reviewer",
                        "performance-reviewer",
                        "plugin-validator",
                        "pr-author",
                        "prototype-builder",
                        "refactorer",
                        "reliability-reviewer",
                        "security-reviewer",
                        "test-author",
                        "ui-test-author"
                      ],
                      "type": "string"
                    },
                    "uniqueItems": true,
                    "maxItems": 18,
                    "minItems": 1
                  },
                  "categories": {
                    "type": "array",
                    "items": {
                      "enum": [
                        "docs",
                        "pr",
                        "implementation",
                        "tests",
                        "debug",
                        "review",
                        "prototype",
                        "refactor"
                      ],
                      "type": "string"
                    },
                    "uniqueItems": true,
                    "maxItems": 8,
                    "minItems": 1
                  }
                },
                "required": [
                  "report_hash",
                  "profile_hash",
                  "expires_at",
                  "host_revision",
                  "router_request",
                  "router_identity",
                  "roles",
                  "categories"
                ],
                "additionalProperties": false
              },
              {
                "type": "null"
              }
            ]
          }
        },
        "required": [
          "id",
          "host",
          "model",
          "effort",
          "roles",
          "categories",
          "capabilities",
          "context_tokens",
          "quality",
          "latency_ms",
          "cost_usd",
          "usage_tokens",
          "profile_revision",
          "qualification"
        ],
        "additionalProperties": false
      },
      "uniqueItems": true,
      "maxItems": 16,
      "minItems": 0
    }
  },
  "required": [
    "schema_version",
    "mode",
    "router_model",
    "key_env",
    "timeout_ms",
    "max_calls",
    "data_mode",
    "objective",
    "min_confidence",
    "allowed_candidates",
    "adaptive_roles",
    "max_cost_usd",
    "max_latency_ms",
    "candidates"
  ],
  "additionalProperties": false
}
